{
  "channel_id": "01_CHRONODRIFT",
  "brand_name": "CHRONODRIFT",
  "handle": "@ChronoDriftOfficial",
  "tagline": "Urban Time Travel & Future Cities (1626 ➔ 2026 ➔ 2226)",
  "niche": "Vuelos FPV Tritemporales por Ciudades con Música Flow y Datos Científicos",
  "target_rpm_usd": "$12.50 – $24.00 USD",
  "target_retention": "91% (1m) / 72% (AVD)",
  "brand_colors": {
    "primary_cyan": "#00e5ff",
    "secondary_orange": "#ffb300",
    "accent_purple": "#b388ff",
    "void_black": "#07090e",
    "carbon_titanium": "#161b26",
    "photonic_white": "#ffffff",
    "amber_past": "#d4a373",
    "hyper_future_violet": "#7c4dff"
  },
  "typography": {
    "display_titles": "Syne (ExtraBold 800, tracking -0.03em)",
    "hud_telemetry": "JetBrains Mono / Share Tech Mono (Tabular Numbers, tracking +0.05em)",
    "body_captions": "Plus Jakarta Sans / Inter (Regular 400 / SemiBold 600)"
  },
  "scraping_6dof_config": {
    "provider": "google_street_view_api + openstreetmap_overpass",
    "canonical_perspectives": [
      {
        "id": "CAM_N",
        "name": "North Axial Reference",
        "heading_deg": 0.0,
        "pitch_deg": 0.0,
        "roll_deg": 0.0,
        "fov_deg": 90,
        "description": "Vector de referencia axial norte y fachada frontal",
        "matrix_role": "Frontal Axis Reference"
      },
      {
        "id": "CAM_E",
        "name": "East Lateral Flank",
        "heading_deg": 90.0,
        "pitch_deg": 0.0,
        "roll_deg": 0.0,
        "fov_deg": 90,
        "description": "Paraje lateral derecho y continuidad de horizonte",
        "matrix_role": "Right Flank Parallax"
      },
      {
        "id": "CAM_S",
        "name": "South Retreat Axis",
        "heading_deg": 180.0,
        "pitch_deg": 0.0,
        "roll_deg": 0.0,
        "fov_deg": 90,
        "description": "Retro-perspectiva y anclaje de fuga trasera",
        "matrix_role": "Rear Escape Anchor"
      },
      {
        "id": "CAM_W",
        "name": "West Lateral Flank",
        "heading_deg": 270.0,
        "pitch_deg": 0.0,
        "roll_deg": 0.0,
        "fov_deg": 90,
        "description": "Paraje lateral izquierdo y paralaje de sombra",
        "matrix_role": "Left Flank Parallax"
      },
      {
        "id": "CAM_PITCH_DOWN",
        "name": "Vertical Dive (Picado)",
        "heading_deg": "TARGET_VECTOR",
        "pitch_deg": -20.0,
        "roll_deg": 0.0,
        "fov_deg": 100,
        "description": "Textura de calzada, escala peatonal y relieve basal",
        "matrix_role": "Ground Texture & Human Scale"
      },
      {
        "id": "CAM_PITCH_UP",
        "name": "Vertical Surge (Contrapicado)",
        "heading_deg": "TARGET_VECTOR",
        "pitch_deg": 25.0,
        "roll_deg": 0.0,
        "fov_deg": 100,
        "description": "Cúspide de rascacielos, cañón urbano y cielo abierto",
        "matrix_role": "Skyscraper Pinnacle & Skyline"
      }
    ],
    "equirectangular_spherical_360": {
      "master_resolution": "7680x3840",
      "aspect_ratio": "2:1",
      "cubemap_decomposition": [
        {"face": "front", "heading_deg": 0.0, "pitch_deg": 0.0},
        {"face": "right", "heading_deg": 90.0, "pitch_deg": 0.0},
        {"face": "back", "heading_deg": 180.0, "pitch_deg": 0.0},
        {"face": "left", "heading_deg": 270.0, "pitch_deg": 0.0},
        {"face": "top", "heading_deg": 0.0, "pitch_deg": 90.0},
        {"face": "bottom", "heading_deg": 0.0, "pitch_deg": -90.0}
      ]
    },
    "osm_overpass_query": {
      "features": ["building:levels", "height", "min_height", "roof:shape", "building:part", "amenity", "historic", "highway"],
      "radius_meters": 500,
      "dem_elevation_source": "Copernicus_DEM_30m",
      "coordinate_precision": 6
    },
    "optical_quality_filters": {
      "min_resolution": "3840x2160",
      "min_filesize_kb": 5.0,
      "laplacian_sharpness_min": 100.0,
      "color_depth": "10-bit HDR / BT.709 sRGB",
      "max_compression_artifacts": "strict_zero_tolerance"
    }
  },
  "video_generator": {
    "engine": "gemini-omni-flash-preview",
    "provider": "google_flow",
    "zero_veo3_mandate": true,
    "zero_veo3_rationale": "Eliminación de morphing temporal descontrolado, soporte nativo de multi-referencias 6-DoF, spline de trayectoria de cámara sin deformaciones y latencia de inferencia lineal.",
    "fps": 60,
    "resolution": "3840x2160",
    "aspect_ratio_master": "16:9",
    "aspect_ratio_shorts": "9:16",
    "keyframes_per_shot": 7,
    "keyframe_generator_model": "gemini-3.1-flash-image (Nano Banana Pro)",
    "official_google_flow_syntax_template": "[# Sources <FIRST_FRAME>@Keyframe_Start] [# References <IMAGE_REF_0>@Cam_N <IMAGE_REF_1>@Cam_E <IMAGE_REF_2>@Cam_S <IMAGE_REF_3>@Cam_W <IMAGE_REF_4>@Cam_PitchDown <IMAGE_REF_5>@Cam_PitchUp]",
    "prompt_structure_schema": {
      "1_subject": "Núcleo arquitectónico y geográfico con anclaje de época exacta (1626, 2026, 2226)",
      "2_visual_specifics": "Materiales físicos reales (madera de roble, adoquines, vidrio low-E, nanotubos de grafeno)",
      "3_action_motion": "Vector de desplazamiento 6-DoF continuo (km/h, AGL, pitch, roll, yaw)",
      "4_camera_optics": "35mm f/1.8 Anamorphic prime, obturación 180° (1/120s motion blur a 60fps)",
      "5_lighting_atmosphere": "Iluminación volumétrica, niebla realista, reflejos especulares, god rays",
      "6_audio_grounding": "Pistas auditivas diegéticas y de viento para inferencia multimodal",
      "7_style_constraints": "Fotorrealismo documental BBC Earth / IMAX, cero AI slop, líneas arquitectónicas estables"
    },
    "shotlist_canon_7d": [
      {
        "index": 1,
        "code": "01_TERMINAL_DIVE",
        "timing_sec": "0-3s",
        "duration_sec": 3.05,
        "bars_at_118bpm": 1.5,
        "angle": "Picado vertical 90°",
        "altitude_agl_m": "850m ➔ 35m",
        "speed_kmh": 140,
        "narrative_role": "Visual Hook & Vortex Inception"
      },
      {
        "index": 2,
        "code": "02_CANYON_DRIFT",
        "timing_sec": "3-10s",
        "duration_sec": 7.12,
        "bars_at_118bpm": 3.5,
        "angle": "Vuelo rasante en cañón urbano",
        "altitude_agl_m": "1.8m ➔ 15m",
        "speed_kmh": 110,
        "narrative_role": "Micro-Geography & Building Scale"
      },
      {
        "index": 3,
        "code": "03_TUNNEL_PIERCE",
        "timing_sec": "10-18s",
        "duration_sec": 8.14,
        "bars_at_118bpm": 4.0,
        "angle": "Penetración rasante en pasajes / arcadas",
        "altitude_agl_m": "2.5m ➔ 4.0m",
        "speed_kmh": 85,
        "narrative_role": "Diegetic Foley & Enclosed Proximity (Match-Cut Temporal)"
      },
      {
        "index": 4,
        "code": "04_MONUMENT_ORBIT",
        "timing_sec": "18-25s",
        "duration_sec": 7.12,
        "bars_at_118bpm": 3.5,
        "angle": "Órbita 360° helicoidal",
        "altitude_agl_m": "25m ➔ 85m",
        "speed_kmh": 65,
        "narrative_role": "Historical Landmark 3D Anchoring & Billboard HUD"
      },
      {
        "index": 5,
        "code": "05_PEDESTRIAN_SWOOP",
        "timing_sec": "25-32s",
        "duration_sec": 7.12,
        "bars_at_118bpm": 3.5,
        "angle": "Vuelo a ras de suelo (escala humana)",
        "altitude_agl_m": "1.5m ➔ 12m",
        "speed_kmh": 45,
        "narrative_role": "Street Level Atmosphere & Bioclimatic Future Shift"
      },
      {
        "index": 6,
        "code": "06_VERTICAL_SURGE",
        "timing_sec": "32-38s",
        "duration_sec": 6.10,
        "bars_at_118bpm": 3.0,
        "angle": "Ascenso vertical trepando fachadas",
        "altitude_agl_m": "12m ➔ 300m",
        "speed_kmh": 125,
        "narrative_role": "Vertical Momentum & Stratospheric Reveal"
      },
      {
        "index": 7,
        "code": "07_SKYLINE_SUNSET_ASCENSION",
        "timing_sec": "38-45s",
        "duration_sec": 7.12,
        "bars_at_118bpm": 3.5,
        "angle": "Gran angular panorámico",
        "altitude_agl_m": "300m ➔ 500m",
        "speed_kmh": 90,
        "narrative_role": "Tritemporal Horizon Climax & Outro Resolution"
      }
    ],
    "cinematography_specs": {
      "lens_optics": "35mm f/1.8 Prime & 50mm f/1.2 Anamorphic (1.33x horizontal squeeze)",
      "film_stock_grain": "Kodak Vision3 500T 5219 subtle physical grain",
      "colorimetry": "ARRI Alexa LF LogC / Rec.709 D65 Master",
      "lighting": "Volumetric aerial fog, raymarched God rays, physical caustics",
      "shutter_angle": "180° (1/120s motion blur at 60fps)"
    }
  },
  "audio_engineering": {
    "bpm": 118,
    "time_signature": "4/4",
    "grid_timings": {
      "beat_duration_ms": 508.47,
      "bar_duration_ms": 2033.90,
      "phrase_4bar_ms": 8135.59
    },
    "genre": "Flow Chillhop / Urban Lo-Fi & Darksynth (Custom Synthesized & Curated)",
    "master_standards": {
      "standard": "EBU R128 / ITU-R BS.1770-4",
      "target_integrated_lufs": -14.0,
      "lufs_tolerance": 0.5,
      "true_peak_max_dbtp": -1.0,
      "loudness_range_lra_target": 7.0
    },
    "dynamic_ducking": {
      "attenuation_under_vo_db": -18.0,
      "linear_attenuation_factor": 0.1258,
      "climax_instrumental_db": 0.0,
      "attack_time_ms": 30.0,
      "release_time_ms": 250.0,
      "hold_time_ms": 50.0,
      "ffmpeg_sidechain_filter": "sidechaincompress=threshold=0.08:ratio=6:attack=30:release=250:level_in=1"
    },
    "synchronization": {
      "method": "VO-First Anchor",
      "tool": "Whisper Stable-TS (word-level timestamps)",
      "telemetry_sync": "Frame-accurate React HUD synchronization"
    },
    "foley_sound_design": {
      "fpv_drone": "Binaural 5-inch carbon prop-whine with wind-shear aerodynamic drag",
      "spatial_doppler": "Real-time 3D frequency pitch-shift on architectural proximity (delta_f = f0 * v / (v - vs))",
      "era_diegic_foley": {
        "past_1626": "Wooden creaks, horse hooves, atmospheric wind, vintage iron bell toll",